<?xml version="1.0" encoding="UTF-8"?>
<tns:processors xmlns:tns="http://www.example.org/demo/"
	xmlns:xsi="http://www.w3.org/2001/XMLSchema-instance"
	xsi:schemaLocation="http://www.example.org/demo/ processor.xsd ">
	<processor name="netease_news">
		<filter handler="regexFilter">
			<param name="regex" value=".*" />
			<param name="text" ref="html" />
			<element handler="testHandler" name="" output="true">
				<param name="" ref="" value="" />
			</element>
			<element handler="testHandler" name="" output="true">
				<param name="" ref="" value="" />
			</element>
			<output handler="">
				<param name="" ref="" value="" />
			</output>
		</filter>
	</processor>
	<processorFactory path="">
		<processor>
			<filter handler="">
				<param name="" ref="" value="" />
				<filter handler="" />
				<element handler="" name="" output="true">
					<param name="" ref="" value="" />
				</element>
			</filter>
			<element handler="" name="" output="true">
				<param name="" ref="" value="" />
			</element>
			<output handler="">
				<param name="" ref="" value="" />
			</output>
		</processor>
	</processorFactory>
</tns:processors>
